{
  "asset_id": "asset9_cases",
  "asset_name": "圣济总录六十甲子岁图医案库",
  "asset_description": "宋《圣济总录》运气门六十甲子岁图蒸馏的逐年运气医案。每条含岁运/司天在泉/rag_keys/六步客气病机与治法/年病机/年治法/原文摘录。可按 rag_key 检索同类格局医案。",
  "data_source": "宋·徽宗赵佶敕撰《政和圣济总录》卷第一、卷第二·运气（公版，rag-knowledge-base/literature/圣济总录运气门）",
  "distill_method": "workflow 6 agent 并行蒸馏原文六十甲子岁图，逐条基于原文提取，不编造",
  "entry_count": 60,
  "lookup_fields": [
    "rag_keys.suiyun",
    "rag_keys.sitian",
    "rag_keys.zaiquan",
    "ganzhi",
    "case_id"
  ],
  "entries": [
    {
      "case_id": "shengji_jiazi",
      "ganzhi": "甲子",
      "year_chart": "甲子岁图",
      "suiyun": "土运太过",
      "sitian": "少阴君火司天",
      "zaiquan": "阳明燥金在泉",
      "rag_keys": {
        "suiyun": "earth_excess",
        "sitian": "shaoyin_junhuo_sitian",
        "zaiquan": "yangming_zaojin_zaiquan"
      },
      "six_steps": [
        {
          "step": "初之气",
          "keqi": "太阳水",
          "zhuqi": "太角木",
          "bingji": "关节禁固，腰痛，炎暑将起，中外疮疡",
          "zhifa": "治太阳之客，以苦补之，以咸泻之，以苦坚之，以辛润之"
        },
        {
          "step": "二之气",
          "keqi": "厥阴木",
          "zhuqi": "少徵火",
          "bingji": "淋、目瞑、目赤，气郁于上而热",
          "zhifa": "治厥阴之客，以辛补之，以酸泻之，以甘缓之"
        },
        {
          "step": "三之气",
          "keqi": "少阴火",
          "zhuqi": "少徵火",
          "bingji": "气厥心痛，寒热更作，咳喘目赤",
          "zhifa": "治少阴之客，以咸补之，以甘泻之，以酸收之"
        },
        {
          "step": "四之气",
          "keqi": "太阴土",
          "zhuqi": "太宫土",
          "bingji": "寒热、嗌干、黄瘅、鼽衄饮发",
          "zhifa": "治太阴之客，以甘补之，以苦泻之，以甘缓之"
        },
        {
          "step": "五之气",
          "keqi": "少阳火",
          "zhuqi": "少商金",
          "bingji": "温",
          "zhifa": "治少阳之客，以咸补之，以甘泻之，以咸软之"
        },
        {
          "step": "终之气",
          "keqi": "阳明金",
          "zhuqi": "太羽水",
          "bingji": "肿于上咳喘，甚则血溢，寒气数举，病生皮腠，内舍于胁，下连少腹而作寒中",
          "zhifa": "治阳明之客，以酸补之，以辛泻之，以苦泄之"
        }
      ],
      "year_pathogenesis": "热病生于上，清病生于下，寒热互作而争于中，民病咳喘、血溢血泄、鼽嚏、目赤疡，寒厥入胃，心痛、腰痛、腹大、嗌干肿上",
      "year_treatment": "咸以软之而调其上，甚则以苦发之，以酸收之，而安其下，甚则以苦泄之，运同地气，当以温热化",
      "source_quote": "民病咳喘、血溢血泄、鼽嚏、目赤疡，寒厥入胃，心痛、腰痛、腹大、嗌干肿上。咸以软之而调其上，甚则以苦发之，以酸收之，而安其下，甚则以苦泄之。",
      "code": "earth_excess",
      "sitian_key": "shaoyin_junhuo_sitian",
      "zaiquan_key": "yangming_zaojin_zaiquan",
      "rag_key": "shaoyin_junhuo_sitian",
      "name": "甲子岁图",
      "modern_reading": "甲子年是土运太过遇上少阴君火司天、阳明燥金在泉，上面火燥、下面寒清，寒热在中间相争。古人看到咳喘、血溢、目赤又夹杂腰痛腹大，不是矛盾，而是天地气机上下不调映在人身上——这正是天人合一的落地：人不是孤立运行，是被嵌进天地这盘气里的。当代启示是，遇到寒热错杂的复杂证，别急着单一归因，要看当年的气化格局。太过即偏，中和才是稳。"
    },
    {
      "case_id": "shengji_yichou",
      "ganzhi": "乙丑",
      "year_chart": "乙丑岁图",
      "suiyun": "金运不及",
      "sitian": "太阴湿土司天",
      "zaiquan": "太阳寒水在泉",
      "rag_keys": {
        "suiyun": "metal_deficient",
        "sitian": "taiyin_shitu_sitian",
        "zaiquan": "taiyang_hanshui_zaiquan"
      },
      "six_steps": [
        {
          "step": "初之气",
          "keqi": "厥阴木",
          "zhuqi": "太角木",
          "bingji": "血溢筋络拘强，关节不利，身重筋痿",
          "zhifa": "治厥阴之客，以辛补之，以酸泻之，以甘缓之"
        },
        {
          "step": "二之气",
          "keqi": "少阴火",
          "zhuqi": "少徵火",
          "bingji": "温厉大至，远近咸若",
          "zhifa": "治少阴之客，以咸补之，以甘泻之，以酸收之"
        },
        {
          "step": "三之气",
          "keqi": "太阴土",
          "zhuqi": "少徵火",
          "bingji": "身重肿胸腹满",
          "zhifa": "治太阴之客，以甘补之，以苦泻之，以甘缓之"
        },
        {
          "step": "四之气",
          "keqi": "少阳火",
          "zhuqi": "太宫土",
          "bingji": "腠理热，血暴溢，疟、心腹满热胪胀，甚则肿",
          "zhifa": "治少阳之客，以咸补之，以甘泻之，以咸软之"
        },
        {
          "step": "五之气",
          "keqi": "阳明金",
          "zhuqi": "少商金",
          "bingji": "皮腠病",
          "zhifa": "治阳明之客，以酸补之，以辛泻之，以苦泄之"
        },
        {
          "step": "终之气",
          "keqi": "太阳水",
          "zhuqi": "太羽水",
          "bingji": "关节禁固，腰痛，寒湿持于气交而为疾",
          "zhifa": "治太阳之客，以苦补之，以咸泻之，以苦坚之，以辛润之"
        }
      ],
      "year_pathogenesis": "阴凝于上，寒积于下，民病寒湿、腹满、身愤、肿、痞逆、寒厥拘急",
      "year_treatment": "以苦热治其上，以甘热治其下，以酸和调其中，燥之温之，甚则发之泄之",
      "source_quote": "民病寒湿、腹满、身愤、肿、痞逆、寒厥拘急。以苦热治其上，以甘热治其下，以酸和调其中，燥之温之，甚则发之泄之。",
      "code": "metal_deficient",
      "sitian_key": "taiyin_shitu_sitian",
      "zaiquan_key": "taiyang_hanshui_zaiquan",
      "rag_key": "taiyin_shitu_sitian",
      "name": "乙丑岁图",
      "modern_reading": "乙丑年金运不及，太阴湿土司天、太阳寒水在泉，阴寒凝于上、寒积于下，民病寒湿腹满、痞逆拘急。为什么古人这么看？因为运气学眼里湿与寒都是阴邪，今年天地气化的基调偏阴凝，人的气机也跟着滞——这就是气化思想，天地有什么气，人就活在什么场里。当代启示：寒湿之年养护重在温通，莫贪凉饮冷。寒湿不是病，是天地给的底色，听懂了就不慌。"
    },
    {
      "case_id": "shengji_bingyin",
      "ganzhi": "丙寅",
      "year_chart": "丙寅岁图",
      "suiyun": "水运太过",
      "sitian": "少阳相火司天",
      "zaiquan": "厥阴风木在泉",
      "rag_keys": {
        "suiyun": "water_excess",
        "sitian": "shaoyang_xianghuo_sitian",
        "zaiquan": "jueyin_fengmu_zaiquan"
      },
      "six_steps": [
        {
          "step": "初之气",
          "keqi": "少阴火",
          "zhuqi": "太角木",
          "bingji": "气怫于上，血溢目赤，咳逆头痛，血崩胁满，肤腠中疮",
          "zhifa": "治少阴之客，以咸补之，以甘泻之，以酸收之"
        },
        {
          "step": "二之气",
          "keqi": "太阴土",
          "zhuqi": "少徵火",
          "bingji": "热郁于上，咳逆呕吐，疮发于中，胸嗌不利，头痛身热，昏愦脓疮",
          "zhifa": "治太阴之客，以甘补之，以苦泻之，以甘缓之"
        },
        {
          "step": "三之气",
          "keqi": "少阳火",
          "zhuqi": "少徵火",
          "bingji": "热中、聋瞑、血溢、脓疮、咳呕、鼽衄、嚏欠、喉痹、目赤，善暴死",
          "zhifa": "治少阳之客，以咸补之，以甘泻之，以咸软之"
        },
        {
          "step": "四之气",
          "keqi": "阳明金",
          "zhuqi": "太宫土",
          "bingji": "满身重",
          "zhifa": "治阳明之客，以酸补之，以辛泻之，以苦泄之"
        },
        {
          "step": "五之气",
          "keqi": "太阳水",
          "zhuqi": "少商金",
          "bingji": "阳乃去，寒乃来，气门乃闭，刚木早雕",
          "zhifa": "治太阳之客，以苦补之，以咸泻之，以苦坚之，以辛润之"
        },
        {
          "step": "终之气",
          "keqi": "厥阴木",
          "zhuqi": "太羽水",
          "bingji": "关闭不禁心痛，阳气不藏而咳",
          "zhifa": "治厥阴之客，以辛补之，以酸泻之，以甘缓之"
        }
      ],
      "year_pathogenesis": "民病寒中，外发疮疡，内为泄满，往复之作，民病寒热疟泄聋瞑呕吐，上怫肿色变",
      "year_treatment": "以咸寒调上，以辛温调下，以咸温调中，渗之泄之，渍之发之",
      "source_quote": "民病寒中，外发疮疡，内为泄满。往复之作，民病寒热疟泄聋瞑呕吐，上怫肿色变。以咸寒调上，以辛温调下，以咸温调中。",
      "code": "water_excess",
      "sitian_key": "shaoyang_xianghuo_sitian",
      "zaiquan_key": "jueyin_fengmu_zaiquan",
      "rag_key": "shaoyang_xianghuo_sitian",
      "name": "丙寅岁图",
      "modern_reading": "丙寅年水运太过，少阳相火司天、厥阴风木在泉，外发疮疡、内为泄满，寒热往复发作。上热下寒、外热内寒，看似矛盾，其实是气化节律里水火风三气交争的写照。古人把人放回天地气机里看，才看得清这种错杂——天人合一不是玄学，是把自己放回节律里去读。当代启示：反复寒热疮疡泄满同见时，想想当年的气机格局，别只盯局部。看懂气化，才看得懂错杂。"
    },
    {
      "case_id": "shengji_dingmao",
      "ganzhi": "丁卯",
      "year_chart": "丁卯岁图",
      "suiyun": "木运不及",
      "sitian": "阳明燥金司天",
      "zaiquan": "少阴君火在泉",
      "rag_keys": {
        "suiyun": "wood_deficient",
        "sitian": "yangming_zaojin_sitian",
        "zaiquan": "shaoyin_junhuo_zaiquan"
      },
      "six_steps": [
        {
          "step": "初之气",
          "keqi": "太阴土",
          "zhuqi": "少角木",
          "bingji": "中热胀，面目浮肿，善眠，鼽衄嚏欠呕，小便黄赤，甚则淋（其病亦少）",
          "zhifa": "调太阴之客，以甘补之，以苦泻之，以甘缓之"
        },
        {
          "step": "二之气",
          "keqi": "少阳火",
          "zhuqi": "太徵火",
          "bingji": "厉大至，民善暴死（厉疾自微）",
          "zhifa": "调少阳之客，以咸补之，以甘泻之，以咸软之"
        },
        {
          "step": "三之气",
          "keqi": "阳明金",
          "zhuqi": "太徵火",
          "bingji": "寒热",
          "zhifa": "调阳明之客，以酸补之，以辛泻之，以苦泄之"
        },
        {
          "step": "四之气",
          "keqi": "太阳水",
          "zhuqi": "太宫土",
          "bingji": "暴仆、振栗、谵妄、少气、嗌干引饮，及为心痛、痈肿、疮疡、疟寒之疾，骨痿血便",
          "zhifa": "调太阳之客，以苦补之，以咸泻之，以苦坚之，以辛润之"
        },
        {
          "step": "五之气",
          "keqi": "厥阴木",
          "zhuqi": "太商金",
          "bingji": "民气和，自无疾病",
          "zhifa": "调厥阴之客，以辛补之，以酸泻之，以甘缓之"
        },
        {
          "step": "终之气",
          "keqi": "少阴火",
          "zhuqi": "少羽水",
          "bingji": "温",
          "zhifa": "调少阴之客，以咸补之，以甘泻之，以酸收之"
        }
      ],
      "year_pathogenesis": "清热之气，持于气交，民病咳嗌塞，寒热发暴，振栗癃闭",
      "year_treatment": "以苦辛温调上，以咸寒调下，以辛和调中，汗之清之散之",
      "source_quote": "民病咳嗌塞，寒热发暴，振栗癃闭。以苦辛温调上，以咸寒调下，以辛和调中，汗之清之散之。",
      "code": "wood_deficient",
      "sitian_key": "yangming_zaojin_sitian",
      "zaiquan_key": "shaoyin_junhuo_zaiquan",
      "rag_key": "yangming_zaojin_sitian",
      "name": "丁卯岁图",
      "modern_reading": "丁卯年木运不及，阳明燥金司天、少阴君火在泉，清燥与热气持于气交，民病咳嗌塞、寒热发暴、振栗癃闭。木气弱则金燥乘、火气逆，古人看的是气机里克与被克的连锁，不是单个症状——这背后是气化思想，一气偏则诸气皆动。当代启示：咳塞伴突然寒热，别只治肺，要看今年气交里哪口气最拧。治病治的是气机的偏，调平即是养。"
    },
    {
      "case_id": "shengji_wuchen",
      "ganzhi": "戊辰",
      "year_chart": "戊辰岁图",
      "suiyun": "火运太过",
      "sitian": "太阳寒水司天",
      "zaiquan": "太阴湿土在泉",
      "rag_keys": {
        "suiyun": "fire_excess",
        "sitian": "taiyang_hanshui_sitian",
        "zaiquan": "taiyin_shitu_zaiquan"
      },
      "six_steps": [
        {
          "step": "初之气",
          "keqi": "少阳火",
          "zhuqi": "少角木",
          "bingji": "温病乃作，身热头痛呕吐，肌腠疮疡",
          "zhifa": "治少阳之客，以咸补之，以甘泻之，以咸软之"
        },
        {
          "step": "二之气",
          "keqi": "阳明金",
          "zhuqi": "太徵火",
          "bingji": "气郁中满，寒乃始",
          "zhifa": "治阳明之客，以酸补之，以辛泻之，以苦泄之"
        },
        {
          "step": "三之气",
          "keqi": "太阳水",
          "zhuqi": "太徵火",
          "bingji": "寒反热中，痈疽注下，心热瞀闷，不治者死",
          "zhifa": "治太阳之客，以苦补之，以咸泻之，以苦坚之，以辛润之"
        },
        {
          "step": "四之气",
          "keqi": "厥阴木",
          "zhuqi": "少宫土",
          "bingji": "大热少气，肌肉萎足痿，注下赤白",
          "zhifa": "治厥阴之客，以辛补之，以酸泻之，以甘缓之"
        },
        {
          "step": "五之气",
          "keqi": "少阴火",
          "zhuqi": "太商金",
          "bingji": "民乃舒",
          "zhifa": "调少阴之客，以咸补之，以苦泻之，以酸收之"
        },
        {
          "step": "终之气",
          "keqi": "太阴土",
          "zhuqi": "少羽水",
          "bingji": "阴凝太虚，埃昏郊野，民乃惨凄，寒风以至，反者孕乃死",
          "zhifa": "治太阴之客，以甘补之，以苦泻之，以甘缓之"
        }
      ],